{
  "matter": {
    "docket_number": "PEN-CV-2026-696",
    "case_id": "MMC-2026-757911",
    "court_county": "Penobscot",
    "court_location": "Bangor",
    "court_type": "Superior Court",
    "case_type": "personal_injury",
    "filing_date": "2026-01-01",
    "event_date": "2024-02-29"
  },
  "parties": {
    "plaintiff": {
      "full_name": "Merle A Thibodeau",
      "first_name": "Merle",
      "middle_name": "A",
      "last_name": "Thibodeau",
      "address": "9 Winterberry Court",
      "city": "Bangor",
      "state": "ME",
      "zip": "04401",
      "phone": "(207) 555-0117",
      "email": "merle.thibodeau@example.com",
      "date_of_birth": "1926-02-29"
    },
    "defendant": {
      "full_name": "Nadia P. Loe",
      "first_name": "Nadia",
      "middle_name": "P",
      "last_name": "Loe",
      "address": "335 Pine Lane",
      "city": "Falmouth",
      "state": "ME",
      "zip": "04069",
      "phone": "(207) 555-0112",
      "email": "nadia.loe@example.org",
      "date_of_birth": "1964-01-30"
    },
    "attorney": {
      "full_name": "Priya C. Roe",
      "first_name": "Priya",
      "middle_name": "C",
      "last_name": "Roe",
      "address": "224 Lighthouse Drive",
      "city": "Falmouth",
      "state": "ME",
      "zip": "04031",
      "phone": "(207) 555-0111",
      "email": "priya.roe@example.net",
      "date_of_birth": "1974-01-31",
      "bar_number": "3028"
    }
  },
  "party": {
    "full_name": "Merle A Thibodeau",
    "first_name": "Merle",
    "middle_name": "A",
    "last_name": "Thibodeau",
    "address": "9 Winterberry Court",
    "city": "Bangor",
    "state": "ME",
    "zip": "04401",
    "phone": "(207) 555-0117",
    "email": "merle.thibodeau@example.com",
    "date_of_birth": "1926-02-29",
    "signature": "Merle A Thibodeau"
  },
  "facts": {
    "accident_date": "2024-02-29",
    "accident_time": "23:58",
    "accident_location": "the crosswalk at Main Street and Water Street, Bangor",
    "police_report_number": "24-000001",
    "sol_statute": "14 M.R.S. § 752 (six years)",
    "sol_expiration_date": "2030-02-28",
    "medical_treatment_date": "2024-02-29",
    "demand_amount": 210314,
    "plaintiff_age_at_accident": 98
  }
}
