{
  "matter": {
    "docket_number": "SAG-GC-2026-310",
    "case_id": "MMC-2026-749078",
    "court_county": "Sagadahoc",
    "court_location": "Bath",
    "court_type": "Probate Court",
    "court_address": "96 Federal Street, Bath, ME 04050",
    "case_type": "guardianship",
    "filing_date": "2026-05-31"
  },
  "parties": {
    "petitioner": {
      "full_name": "Olivia B. Ellsworth",
      "first_name": "Olivia",
      "middle_name": "B",
      "last_name": "Ellsworth",
      "address": "39 Meadowbrook Drive",
      "city": "Yarmouth",
      "state": "ME",
      "zip": "04047",
      "phone": "(207) 555-0174",
      "email": "olivia.ellsworth@example.com",
      "date_of_birth": "1969-04-20"
    },
    "respondent": {
      "full_name": "Maria Q. Fairbanks",
      "first_name": "Maria",
      "middle_name": "Q",
      "last_name": "Fairbanks",
      "address": "37 Cedar Way",
      "city": "Falmouth",
      "state": "ME",
      "zip": "04071",
      "phone": "(207) 555-0154",
      "email": "maria.fairbanks@example.com",
      "date_of_birth": "1965-03-05"
    },
    "child_1": {
      "full_name": "Rosa P. Kingsley",
      "first_name": "Rosa",
      "middle_name": "P",
      "last_name": "Kingsley",
      "date_of_birth": "2024-04-23"
    },
    "attorney": {
      "full_name": "John E. Jessup",
      "first_name": "John",
      "middle_name": "E",
      "last_name": "Jessup",
      "address": "150 Lighthouse Drive",
      "city": "Gorham",
      "state": "ME",
      "zip": "04070",
      "phone": "(207) 555-0115",
      "email": "john.jessup@example.net",
      "date_of_birth": "1982-10-14",
      "bar_number": "2688"
    },
    "plaintiff": {
      "full_name": "Olivia B. Ellsworth",
      "first_name": "Olivia",
      "middle_name": "B",
      "last_name": "Ellsworth",
      "address": "39 Meadowbrook Drive",
      "city": "Yarmouth",
      "state": "ME",
      "zip": "04047",
      "phone": "(207) 555-0174",
      "email": "olivia.ellsworth@example.com",
      "date_of_birth": "1969-04-20"
    },
    "defendant": {
      "full_name": "Maria Q. Fairbanks",
      "first_name": "Maria",
      "middle_name": "Q",
      "last_name": "Fairbanks",
      "address": "37 Cedar Way",
      "city": "Falmouth",
      "state": "ME",
      "zip": "04071",
      "phone": "(207) 555-0154",
      "email": "maria.fairbanks@example.com",
      "date_of_birth": "1965-03-05"
    }
  },
  "party": {
    "full_name": "Olivia B. Ellsworth",
    "first_name": "Olivia",
    "middle_name": "B",
    "last_name": "Ellsworth",
    "address": "39 Meadowbrook Drive",
    "city": "Yarmouth",
    "state": "ME",
    "zip": "04047",
    "phone": "(207) 555-0174",
    "email": "olivia.ellsworth@example.com",
    "date_of_birth": "1969-04-20",
    "signature": "Olivia B. Ellsworth"
  },
  "facts": {
    "petitioner_relationship": "uncle",
    "reason_for_guardianship": "a parent's substance use treatment",
    "parental_consent": false,
    "guardianship_type": "full guardianship of a minor",
    "current_living_arrangement": "the child already lives with the petitioner",
    "duration": "until the minor reaches 18 or further court order",
    "minor_count": "1"
  }
}
