{
  "matter": {
    "docket_number": "CUM-FM-2026-913",
    "case_id": "MMC-2026-360494",
    "court_county": "Cumberland",
    "court_location": "Portland",
    "court_type": "District Court",
    "case_type": "family_matters",
    "filing_date": "2026-02-13",
    "event_date": "2025-04-20"
  },
  "parties": {
    "plaintiff": {
      "full_name": "Olivia B. Ellsworth",
      "first_name": "Olivia",
      "middle_name": "B",
      "last_name": "Ellsworth",
      "address": "39 Meadowbrook Drive",
      "city": "Yarmouth",
      "state": "ME",
      "zip": "04047",
      "phone": "(207) 555-0174",
      "email": "olivia.ellsworth@example.com",
      "date_of_birth": "1969-04-20"
    },
    "defendant": {
      "full_name": "Maria Q. Fairbanks",
      "first_name": "Maria",
      "middle_name": "Q",
      "last_name": "Fairbanks",
      "address": "37 Cedar Way",
      "city": "Falmouth",
      "state": "ME",
      "zip": "04071",
      "phone": "(207) 555-0154",
      "email": "maria.fairbanks@example.com",
      "date_of_birth": "1965-03-05"
    },
    "child_1": {
      "full_name": "Ingrid B. Kingsley",
      "first_name": "Ingrid",
      "middle_name": "B",
      "last_name": "Kingsley",
      "date_of_birth": "2013-01-26"
    },
    "child_2": {
      "full_name": "Marcus W. Roe",
      "first_name": "Marcus",
      "middle_name": "W",
      "last_name": "Roe",
      "date_of_birth": "2021-05-29"
    },
    "child_3": {
      "full_name": "Omar W. Loe",
      "first_name": "Omar",
      "middle_name": "W",
      "last_name": "Loe",
      "date_of_birth": "2022-10-20"
    },
    "attorney": {
      "full_name": "Diego F. Jessup",
      "first_name": "Diego",
      "middle_name": "F",
      "last_name": "Jessup",
      "address": "54 Tidewater Lane",
      "city": "Bangor",
      "state": "ME",
      "zip": "04048",
      "phone": "(207) 555-0112",
      "email": "diego.jessup@example.net",
      "date_of_birth": "1956-02-02",
      "bar_number": "1976"
    }
  },
  "party": {
    "full_name": "Olivia B. Ellsworth",
    "first_name": "Olivia",
    "middle_name": "B",
    "last_name": "Ellsworth",
    "address": "39 Meadowbrook Drive",
    "city": "Yarmouth",
    "state": "ME",
    "zip": "04047",
    "phone": "(207) 555-0174",
    "email": "olivia.ellsworth@example.com",
    "date_of_birth": "1969-04-20",
    "signature": "Olivia B. Ellsworth"
  },
  "facts": {
    "marriage_date": "2010-08-15",
    "marriage_city": "Camden",
    "marriage_county": "Penobscot",
    "marriage_state": "Maine",
    "separation_date": "2025-04-20",
    "grounds": "Irreconcilable marital differences",
    "residency_months": 36,
    "spousal_support_requested": false,
    "marital_home": "jointly owned condominium",
    "num_minor_children": "3",
    "primary_residence_parent": "Maria Q. Fairbanks"
  }
}
