{
  "matter": {
    "docket_number": "CUM-BUS-2026-171",
    "case_id": "MMC-2026-538485",
    "court_county": "Cumberland",
    "court_location": "Portland",
    "court_type": "Superior Court (Business and Consumer Docket)",
    "case_type": "contract_dispute",
    "filing_date": "2026-03-14"
  },
  "parties": {
    "plaintiff": {
      "full_name": "Casco Bay Marine Infrastructure Group, Inc.",
      "address": "400 Commercial Street, Pier 2",
      "city": "Portland",
      "state": "ME",
      "zip": "04101",
      "phone": "(207) 555-0154"
    },
    "defendant": {
      "full_name": "Penobscot Narrows Terminal Authority LLC",
      "address": "2 Waterfront Way",
      "city": "Bucksport",
      "state": "ME",
      "zip": "04416",
      "phone": "(207) 555-0187"
    },
    "attorney": {
      "full_name": "Olivia B. Ellsworth",
      "first_name": "Olivia",
      "middle_name": "B",
      "last_name": "Ellsworth",
      "address": "39 Meadowbrook Drive",
      "city": "Yarmouth",
      "state": "ME",
      "zip": "04047",
      "phone": "(207) 555-0174",
      "email": "olivia.ellsworth@example.com",
      "date_of_birth": "1969-04-20",
      "bar_number": "2408"
    }
  },
  "party": {
    "full_name": "Casco Bay Marine Infrastructure Group, Inc.",
    "address": "400 Commercial Street, Pier 2",
    "city": "Portland",
    "state": "ME",
    "zip": "04101",
    "phone": "(207) 555-0154",
    "signature": "Casco Bay Marine Infrastructure Group, Inc."
  },
  "facts": {
    "contract_value": 123456789.1,
    "retainage_withheld": 6172839.46,
    "disputed_penny": 0.01,
    "liquidated_damages_setoff": -2500.75,
    "zero_dollar_change_order": 0,
    "half_cent_interest_item": 1234.565,
    "reconciliation_period": "final project reconciliation, payment applications 1 through 47"
  }
}
