{
  "matter": {
    "case_id": "MMC-2026-932967",
    "court_county": "Sagadahoc",
    "court_location": "Bath",
    "court_type": "Private closing / Maine Secretary of State",
    "case_type": "business_asset_sale",
    "filing_date": "2026-01-14",
    "event_date": "2026-05-16"
  },
  "parties": {
    "seller": {
      "full_name": "Grace C. Roe",
      "first_name": "Grace",
      "middle_name": "C",
      "last_name": "Roe",
      "address": "422 Spruce Avenue",
      "city": "Yarmouth",
      "state": "ME",
      "zip": "04047",
      "phone": "(207) 555-0174",
      "email": "grace.roe@example.com",
      "date_of_birth": "1969-04-20"
    },
    "buyer": {
      "full_name": "Maria Q. Fairbanks",
      "first_name": "Maria",
      "middle_name": "Q",
      "last_name": "Fairbanks",
      "address": "37 Cedar Way",
      "city": "Falmouth",
      "state": "ME",
      "zip": "04071",
      "phone": "(207) 555-0154",
      "email": "maria.fairbanks@example.com",
      "date_of_birth": "1965-03-05"
    },
    "attorney": {
      "full_name": "Ingrid B. Kingsley",
      "first_name": "Ingrid",
      "middle_name": "B",
      "last_name": "Kingsley",
      "address": "297 Tidewater Lane",
      "city": "Ellsworth",
      "state": "ME",
      "zip": "04007",
      "phone": "(207) 555-0128",
      "email": "ingrid.kingsley@example.com",
      "date_of_birth": "1966-03-10",
      "bar_number": "7867"
    }
  },
  "party": {
    "full_name": "Maria Q. Fairbanks",
    "first_name": "Maria",
    "middle_name": "Q",
    "last_name": "Fairbanks",
    "address": "37 Cedar Way",
    "city": "Falmouth",
    "state": "ME",
    "zip": "04071",
    "phone": "(207) 555-0154",
    "email": "maria.fairbanks@example.com",
    "date_of_birth": "1965-03-05",
    "signature": "Maria Q. Fairbanks"
  },
  "facts": {
    "business_name": "Casco Bay Landscaping, Inc.",
    "business_type": "a precision machine shop",
    "entity_form": "a member-managed LLC",
    "years_in_business": 19,
    "employee_count": 19,
    "deal_structure": "an asset purchase (not a stock/equity purchase)",
    "new_entity_name": "Downeast Dental Partners LLC",
    "purchase_price": 6897794,
    "annual_revenue": 4169227,
    "ebitda": 2477406,
    "ebitda_multiple": "3.5x",
    "addbacks": "related-party rent normalized to market",
    "working_capital_target": 214992,
    "wc_adjustment": "a dollar-for-dollar working-capital true-up against a pegged target at closing",
    "escrow_holdback": "a 12-month holdback of 8% of the price",
    "earnout": "a 2-year earnout of up to $400,000 tied to gross-profit retention",
    "seller_note": "no seller financing",
    "financing_type": "a bank term loan with a revolving line for working capital",
    "loan_amount": 7573808,
    "noncompete": "a 3-year non-compete plus a 1-year consulting agreement",
    "allocation_basis": "an IRC § 1060 purchase-price allocation on Form 8594 across Class I-VII assets",
    "key_assets": "machinery, WIP inventory, and the trade name",
    "assumed_liabilities": "specified trade payables and customer deposits",
    "lease_status": "a new 10-year lease with the seller as landlord",
    "effective_date": "2026-01-17",
    "qoe_deadline": "2026-03-06",
    "closing_date": "2026-05-16"
  }
}
