{
  "matter": {
    "docket_number": "SAG-CV-2025-406",
    "case_id": "MMC-2025-479146",
    "court_county": "Sagadahoc",
    "court_location": "Bath",
    "court_type": "Superior Court",
    "case_type": "personal_injury",
    "filing_date": "2025-10-01",
    "event_date": "2024-05-30"
  },
  "parties": {
    "plaintiff": {
      "full_name": "Olivia B. Ellsworth",
      "first_name": "Olivia",
      "middle_name": "B",
      "last_name": "Ellsworth",
      "address": "39 Meadowbrook Drive",
      "city": "Yarmouth",
      "state": "ME",
      "zip": "04047",
      "phone": "(207) 555-0174",
      "email": "olivia.ellsworth@example.com",
      "date_of_birth": "1969-04-20"
    },
    "defendant": {
      "full_name": "Maria Q. Fairbanks",
      "first_name": "Maria",
      "middle_name": "Q",
      "last_name": "Fairbanks",
      "address": "37 Cedar Way",
      "city": "Falmouth",
      "state": "ME",
      "zip": "04071",
      "phone": "(207) 555-0154",
      "email": "maria.fairbanks@example.com",
      "date_of_birth": "1965-03-05"
    },
    "defendant_2": {
      "full_name": "Coastal Outfitters LLC",
      "address": "115 Pine Lane",
      "city": "Gorham",
      "state": "ME",
      "zip": "04038",
      "phone": "(207) 555-0153"
    },
    "attorney": {
      "full_name": "Olivia D. Jessup",
      "first_name": "Olivia",
      "middle_name": "D",
      "last_name": "Jessup",
      "address": "294 Elm Terrace",
      "city": "Windham",
      "state": "ME",
      "zip": "04014",
      "phone": "(207) 555-0174",
      "email": "olivia.jessup@example.net",
      "date_of_birth": "1961-04-07",
      "bar_number": "2596"
    }
  },
  "party": {
    "full_name": "Olivia B. Ellsworth",
    "first_name": "Olivia",
    "middle_name": "B",
    "last_name": "Ellsworth",
    "address": "39 Meadowbrook Drive",
    "city": "Yarmouth",
    "state": "ME",
    "zip": "04047",
    "phone": "(207) 555-0174",
    "email": "olivia.ellsworth@example.com",
    "date_of_birth": "1969-04-20",
    "signature": "Olivia B. Ellsworth"
  },
  "facts": {
    "collision_date": "2024-05-30",
    "collision_location": "Interstate 295 northbound near Exit 7",
    "collision_type": "rear-end collision",
    "injury_type": "fractured wrist and ribs",
    "liability_disputed": false,
    "commercial_vehicle": false,
    "medical_specials": 211745,
    "lost_wages": 43175,
    "property_damage": 33513,
    "policy_limits": 664006,
    "comparative_fault_alleged": false
  }
}
