{
  "matter": {
    "docket_number": "SAG-CV-2025-606",
    "case_id": "MMC-2025-650708",
    "court_county": "Sagadahoc",
    "court_location": "Bath",
    "court_type": "Superior Court",
    "case_type": "improvident_transfer",
    "filing_date": "2025-06-17",
    "event_date": "2024-08-11"
  },
  "parties": {
    "plaintiff": {
      "full_name": "Grace C. Roe",
      "first_name": "Grace",
      "middle_name": "C",
      "last_name": "Roe",
      "address": "422 Spruce Avenue",
      "city": "Yarmouth",
      "state": "ME",
      "zip": "04047",
      "phone": "(207) 555-0174",
      "email": "grace.roe@example.com",
      "date_of_birth": "1969-04-20"
    },
    "defendant": {
      "full_name": "Maria Q. Fairbanks",
      "first_name": "Maria",
      "middle_name": "Q",
      "last_name": "Fairbanks",
      "address": "37 Cedar Way",
      "city": "Falmouth",
      "state": "ME",
      "zip": "04071",
      "phone": "(207) 555-0154",
      "email": "maria.fairbanks@example.com",
      "date_of_birth": "1965-03-05"
    },
    "defendant_2": {
      "full_name": "Ingrid B. Kingsley",
      "first_name": "Ingrid",
      "middle_name": "B",
      "last_name": "Kingsley",
      "address": "297 Tidewater Lane",
      "city": "Ellsworth",
      "state": "ME",
      "zip": "04007",
      "phone": "(207) 555-0128",
      "email": "ingrid.kingsley@example.com",
      "date_of_birth": "1966-03-10"
    },
    "other_party": {
      "full_name": "Omar W. Loe",
      "first_name": "Omar",
      "middle_name": "W",
      "last_name": "Loe",
      "address": "62 Tidewater Lane",
      "city": "Waterville",
      "state": "ME",
      "zip": "04072",
      "phone": "(207) 555-0187",
      "email": "omar.loe@example.com",
      "date_of_birth": "1995-10-25"
    },
    "attorney": {
      "full_name": "Ingrid M. Noe",
      "first_name": "Ingrid",
      "middle_name": "M",
      "last_name": "Noe",
      "address": "51 Spruce Avenue",
      "city": "Falmouth",
      "state": "ME",
      "zip": "04073",
      "phone": "(207) 555-0107",
      "email": "ingrid.noe@example.net",
      "date_of_birth": "1988-09-11",
      "bar_number": "8005"
    }
  },
  "party": {
    "full_name": "Grace C. Roe",
    "first_name": "Grace",
    "middle_name": "C",
    "last_name": "Roe",
    "address": "422 Spruce Avenue",
    "city": "Yarmouth",
    "state": "ME",
    "zip": "04047",
    "phone": "(207) 555-0174",
    "email": "grace.roe@example.com",
    "date_of_birth": "1969-04-20",
    "signature": "Grace C. Roe"
  },
  "facts": {
    "transferor_age": 92,
    "dependency_basis": "is homebound and dependent after a stroke",
    "relationship_to_transferee": "a neighbor who became a caregiver",
    "property_transferred": "a shorefront cottage and lot",
    "fair_market_value": 868656,
    "consideration_paid": "a nominal sum far below value",
    "independent_counsel": false,
    "confidential_relationship": true,
    "competency_questioned": true,
    "transfer_date": "2024-08-11",
    "medical_condition": "cognitive decline after a stroke"
  }
}
