{
  "matter": {
    "docket_number": "SAG-GC-2025-161",
    "case_id": "MMC-2025-691783",
    "court_county": "Sagadahoc",
    "court_location": "Bath",
    "court_type": "Probate Court",
    "case_type": "conservatorship",
    "filing_date": "2025-11-08"
  },
  "parties": {
    "petitioner": {
      "full_name": "Grace C. Roe",
      "first_name": "Grace",
      "middle_name": "C",
      "last_name": "Roe",
      "address": "422 Spruce Avenue",
      "city": "Yarmouth",
      "state": "ME",
      "zip": "04047",
      "phone": "(207) 555-0174",
      "email": "grace.roe@example.com",
      "date_of_birth": "1969-04-20"
    },
    "respondent": {
      "full_name": "Maria Q. Fairbanks",
      "first_name": "Maria",
      "middle_name": "Q",
      "last_name": "Fairbanks",
      "address": "37 Cedar Way",
      "city": "Falmouth",
      "state": "ME",
      "zip": "04071",
      "phone": "(207) 555-0154",
      "email": "maria.fairbanks@example.com",
      "date_of_birth": "1965-03-05"
    },
    "attorney": {
      "full_name": "Ingrid B. Kingsley",
      "first_name": "Ingrid",
      "middle_name": "B",
      "last_name": "Kingsley",
      "address": "297 Tidewater Lane",
      "city": "Ellsworth",
      "state": "ME",
      "zip": "04007",
      "phone": "(207) 555-0128",
      "email": "ingrid.kingsley@example.com",
      "date_of_birth": "1966-03-10",
      "bar_number": "7867"
    },
    "plaintiff": {
      "full_name": "Grace C. Roe",
      "first_name": "Grace",
      "middle_name": "C",
      "last_name": "Roe",
      "address": "422 Spruce Avenue",
      "city": "Yarmouth",
      "state": "ME",
      "zip": "04047",
      "phone": "(207) 555-0174",
      "email": "grace.roe@example.com",
      "date_of_birth": "1969-04-20"
    },
    "defendant": {
      "full_name": "Maria Q. Fairbanks",
      "first_name": "Maria",
      "middle_name": "Q",
      "last_name": "Fairbanks",
      "address": "37 Cedar Way",
      "city": "Falmouth",
      "state": "ME",
      "zip": "04071",
      "phone": "(207) 555-0154",
      "email": "maria.fairbanks@example.com",
      "date_of_birth": "1965-03-05"
    }
  },
  "party": {
    "full_name": "Grace C. Roe",
    "first_name": "Grace",
    "middle_name": "C",
    "last_name": "Roe",
    "address": "422 Spruce Avenue",
    "city": "Yarmouth",
    "state": "ME",
    "zip": "04047",
    "phone": "(207) 555-0174",
    "email": "grace.roe@example.com",
    "date_of_birth": "1969-04-20",
    "signature": "Grace C. Roe"
  },
  "facts": {
    "respondent_relationship": "the petitioner's mother",
    "alleged_condition": "a serious developmental disability",
    "petition_type": "both guardianship and conservatorship",
    "respondent_consents": true,
    "least_restrictive_considered": true,
    "estate_value": 418994,
    "monthly_income": 4250,
    "existing_poa": true,
    "care_setting": "lives with the petitioner",
    "physician_evaluation_obtained": true
  }
}
