{
  "matter": {
    "docket_number": "SAG-PE-2026-935",
    "case_id": "MMC-2026-687472",
    "court_county": "Sagadahoc",
    "court_location": "Bath",
    "court_type": "Probate Court",
    "court_address": "96 Federal Street, Bath, ME 04050",
    "case_type": "decedent_estate",
    "filing_date": "2026-05-31",
    "event_date": "2025-09-22",
    "firm_name": "Birchwood & Calloway LLP"
  },
  "parties": {
    "decedent": {
      "full_name": "Olivia B. Ellsworth",
      "first_name": "Olivia",
      "middle_name": "B",
      "last_name": "Ellsworth",
      "date_of_birth": "1997-10-02",
      "entity_type": "person"
    },
    "personal_representative": {
      "full_name": "Theodore B. Kingsley",
      "first_name": "Theodore",
      "middle_name": "B",
      "last_name": "Kingsley",
      "address": "467 Spruce Avenue",
      "city": "Bangor",
      "state": "ME",
      "zip": "04005",
      "phone": "(207) 555-0111",
      "email": "theodore.kingsley@example.org",
      "date_of_birth": "1975-02-05",
      "entity_type": "person"
    },
    "attorney": {
      "full_name": "Maria Q. Jessup",
      "first_name": "Maria",
      "middle_name": "Q",
      "last_name": "Jessup",
      "address": "32 Meadowbrook Drive",
      "city": "Yarmouth",
      "state": "ME",
      "zip": "04029",
      "phone": "(207) 555-0180",
      "email": "maria.jessup@example.net",
      "date_of_birth": "1964-02-01",
      "bar_number": "7499",
      "organization_name": "Birchwood & Calloway LLP",
      "entity_type": "person"
    },
    "plaintiff": {
      "full_name": "Olivia B. Ellsworth",
      "first_name": "Olivia",
      "middle_name": "B",
      "last_name": "Ellsworth",
      "date_of_birth": "1997-10-02",
      "entity_type": "person"
    }
  },
  "party": {
    "full_name": "Theodore B. Kingsley",
    "first_name": "Theodore",
    "middle_name": "B",
    "last_name": "Kingsley",
    "address": "467 Spruce Avenue",
    "city": "Bangor",
    "state": "ME",
    "zip": "04005",
    "phone": "(207) 555-0111",
    "email": "theodore.kingsley@example.org",
    "date_of_birth": "1975-02-05",
    "entity_type": "person",
    "signature": "Theodore B. Kingsley"
  },
  "facts": {
    "date_of_death": "2025-09-22",
    "decedent_domicile_county": "Sagadahoc",
    "relationship_to_decedent": "surviving spouse",
    "approximate_estate_value": 628705,
    "real_property": true,
    "num_heirs": 3,
    "bond_required": false,
    "testacy": "testate",
    "will_exists": true,
    "will_date": "2012-08-22",
    "probate_type": "informal probate",
    "proceeding_type": "informal"
  }
}
