{
  "matter": {
    "docket_number": "SAG-CV-2025-354",
    "case_id": "MMC-2025-414328",
    "court_county": "Sagadahoc",
    "court_location": "Bath",
    "court_type": "Superior Court",
    "case_type": "employment",
    "filing_date": "2025-05-17",
    "event_date": "2024-09-14"
  },
  "parties": {
    "plaintiff": {
      "full_name": "Grace C. Roe",
      "first_name": "Grace",
      "middle_name": "C",
      "last_name": "Roe",
      "address": "422 Spruce Avenue",
      "city": "Yarmouth",
      "state": "ME",
      "zip": "04047",
      "phone": "(207) 555-0174",
      "email": "grace.roe@example.com",
      "date_of_birth": "1969-04-20"
    },
    "defendant": {
      "full_name": "Summit Outfitters Co.",
      "address": "37 Cedar Way",
      "city": "Falmouth",
      "state": "ME",
      "zip": "04071",
      "phone": "(207) 555-0154"
    },
    "defendant_2": {
      "full_name": "John D. Kingsley",
      "first_name": "John",
      "middle_name": "D",
      "last_name": "Kingsley",
      "address": "116 Granite Ridge Road",
      "city": "Brunswick",
      "state": "ME",
      "zip": "04074",
      "phone": "(207) 555-0174",
      "email": "john.kingsley@example.org",
      "date_of_birth": "1998-04-24"
    },
    "attorney": {
      "full_name": "Felix K. Loe",
      "first_name": "Felix",
      "middle_name": "K",
      "last_name": "Loe",
      "address": "216 Birch Street",
      "city": "Yarmouth",
      "state": "ME",
      "zip": "04074",
      "phone": "(207) 555-0139",
      "email": "felix.loe@example.net",
      "date_of_birth": "1958-04-03",
      "bar_number": "4078"
    }
  },
  "party": {
    "full_name": "Grace C. Roe",
    "first_name": "Grace",
    "middle_name": "C",
    "last_name": "Roe",
    "address": "422 Spruce Avenue",
    "city": "Yarmouth",
    "state": "ME",
    "zip": "04047",
    "phone": "(207) 555-0174",
    "email": "grace.roe@example.com",
    "date_of_birth": "1969-04-20",
    "signature": "Grace C. Roe"
  },
  "facts": {
    "protected_class": "disability",
    "adverse_action": "termination",
    "hire_date": "2016-09-01",
    "termination_date": "2024-09-14",
    "reported_internally": false,
    "mhrc_complaint_filed": true,
    "right_to_sue_issued": true,
    "annual_salary": 103027,
    "replacement_younger_or_outside_class": false,
    "performance_reviews": "mixed"
  }
}
