{
  "matter": {
    "docket_number": "SAG-PE-2026-684",
    "case_id": "MMC-2026-709851",
    "court_county": "Sagadahoc",
    "court_location": "Bath",
    "court_type": "Probate Court",
    "case_type": "decedent_estate",
    "filing_date": "2026-05-01",
    "event_date": "2025-06-22"
  },
  "parties": {
    "decedent": {
      "full_name": "Olivia B. Ellsworth",
      "first_name": "Olivia",
      "middle_name": "B",
      "last_name": "Ellsworth",
      "date_of_birth": "1997-10-02"
    },
    "personal_representative": {
      "full_name": "Theodore B. Kingsley",
      "first_name": "Theodore",
      "middle_name": "B",
      "last_name": "Kingsley",
      "address": "467 Spruce Avenue",
      "city": "Bangor",
      "state": "ME",
      "zip": "04005",
      "phone": "(207) 555-0111",
      "email": "theodore.kingsley@example.org",
      "date_of_birth": "1975-02-05"
    },
    "attorney": {
      "full_name": "Maria Q. Jessup",
      "first_name": "Maria",
      "middle_name": "Q",
      "last_name": "Jessup",
      "address": "32 Meadowbrook Drive",
      "city": "Yarmouth",
      "state": "ME",
      "zip": "04029",
      "phone": "(207) 555-0180",
      "email": "maria.jessup@example.net",
      "date_of_birth": "1964-02-01",
      "bar_number": "7499"
    }
  },
  "party": {
    "full_name": "Theodore B. Kingsley",
    "first_name": "Theodore",
    "middle_name": "B",
    "last_name": "Kingsley",
    "address": "467 Spruce Avenue",
    "city": "Bangor",
    "state": "ME",
    "zip": "04005",
    "phone": "(207) 555-0111",
    "email": "theodore.kingsley@example.org",
    "date_of_birth": "1975-02-05",
    "signature": "Theodore B. Kingsley"
  },
  "facts": {
    "date_of_death": "2025-06-22",
    "will_exists": true,
    "relationship_to_decedent": "adult child",
    "total_probate_assets": 55959,
    "total_allowed_claims": 379749,
    "secured_claims": 77815,
    "funeral_and_admin_expenses": 26717,
    "num_creditors": 5,
    "homestead_allowance_claimed": false,
    "estate_is_insolvent": true,
    "proceeding_type": "formal, supervised administration"
  }
}
