{
  "matter": {
    "case_id": "MMC-2025-846702",
    "court_county": "Sagadahoc",
    "court_location": "Bath",
    "court_type": "Maine Registry of Deeds / Maine Revenue Services",
    "case_type": "real_estate_transfer",
    "filing_date": "2025-11-08",
    "event_date": "2026-03-17"
  },
  "parties": {
    "transferor": {
      "full_name": "Grace C. Roe",
      "first_name": "Grace",
      "middle_name": "C",
      "last_name": "Roe",
      "address": "422 Spruce Avenue",
      "city": "Yarmouth",
      "state": "ME",
      "zip": "04047",
      "phone": "(207) 555-0174",
      "email": "grace.roe@example.com",
      "date_of_birth": "1969-04-20"
    },
    "transferee": {
      "full_name": "Maria Q. Fairbanks",
      "first_name": "Maria",
      "middle_name": "Q",
      "last_name": "Fairbanks",
      "address": "37 Cedar Way",
      "city": "Falmouth",
      "state": "ME",
      "zip": "04071",
      "phone": "(207) 555-0154",
      "email": "maria.fairbanks@example.com",
      "date_of_birth": "1965-03-05"
    },
    "attorney": {
      "full_name": "Ingrid B. Kingsley",
      "first_name": "Ingrid",
      "middle_name": "B",
      "last_name": "Kingsley",
      "address": "297 Tidewater Lane",
      "city": "Ellsworth",
      "state": "ME",
      "zip": "04007",
      "phone": "(207) 555-0128",
      "email": "ingrid.kingsley@example.com",
      "date_of_birth": "1966-03-10",
      "bar_number": "7867"
    }
  },
  "party": {
    "full_name": "Maria Q. Fairbanks",
    "first_name": "Maria",
    "middle_name": "Q",
    "last_name": "Fairbanks",
    "address": "37 Cedar Way",
    "city": "Falmouth",
    "state": "ME",
    "zip": "04071",
    "phone": "(207) 555-0154",
    "email": "maria.fairbanks@example.com",
    "date_of_birth": "1965-03-05",
    "signature": "Maria Q. Fairbanks"
  },
  "facts": {
    "property_address": "129 Old Mill Road",
    "property_town": "Portland",
    "property_county": "Sagadahoc",
    "property_map_block_lot": "Map 31, Block 9, Lot 5",
    "purchase_price": 831933,
    "transfer_date": "2026-03-17",
    "property_type": "residential condominium",
    "adjusted_assessed_value": 258061,
    "special_circumstances_explanation": "Partial-interest transfer between family members",
    "deed_type": "quitclaim deed with covenant",
    "financing": "conventional mortgage",
    "transfer_tax_exemption": true
  }
}
