{
  "matter": {
    "case_id": "MMC-2026-414328",
    "court_county": "Sagadahoc",
    "court_location": "Bath",
    "court_type": "Maine Registry of Deeds / private closing",
    "case_type": "real_estate_purchase_sale",
    "filing_date": "2026-01-14",
    "event_date": "2026-03-06"
  },
  "parties": {
    "seller": {
      "full_name": "Grace C. Roe",
      "first_name": "Grace",
      "middle_name": "C",
      "last_name": "Roe",
      "address": "422 Spruce Avenue",
      "city": "Yarmouth",
      "state": "ME",
      "zip": "04047",
      "phone": "(207) 555-0174",
      "email": "grace.roe@example.com",
      "date_of_birth": "1969-04-20"
    },
    "buyer": {
      "full_name": "Maria Q. Fairbanks",
      "first_name": "Maria",
      "middle_name": "Q",
      "last_name": "Fairbanks",
      "address": "37 Cedar Way",
      "city": "Falmouth",
      "state": "ME",
      "zip": "04071",
      "phone": "(207) 555-0154",
      "email": "maria.fairbanks@example.com",
      "date_of_birth": "1965-03-05"
    },
    "attorney": {
      "full_name": "Ingrid B. Kingsley",
      "first_name": "Ingrid",
      "middle_name": "B",
      "last_name": "Kingsley",
      "address": "297 Tidewater Lane",
      "city": "Ellsworth",
      "state": "ME",
      "zip": "04007",
      "phone": "(207) 555-0128",
      "email": "ingrid.kingsley@example.com",
      "date_of_birth": "1966-03-10",
      "bar_number": "7867"
    }
  },
  "party": {
    "full_name": "Maria Q. Fairbanks",
    "first_name": "Maria",
    "middle_name": "Q",
    "last_name": "Fairbanks",
    "address": "37 Cedar Way",
    "city": "Falmouth",
    "state": "ME",
    "zip": "04071",
    "phone": "(207) 555-0154",
    "email": "maria.fairbanks@example.com",
    "date_of_birth": "1965-03-05",
    "signature": "Maria Q. Fairbanks"
  },
  "facts": {
    "property_address": "129 Old Mill Road",
    "property_town": "Portland",
    "property_county": "Sagadahoc",
    "property_map_block_lot": "Map 31, Block 9, Lot 5",
    "property_type": "single-family residential",
    "year_built": 1939,
    "lot_size": "0.51 acres",
    "bedrooms": 2,
    "bathrooms": "3",
    "purchase_price": 481997,
    "earnest_money": 14702,
    "effective_date": "2026-01-07",
    "inspection_deadline": "2026-01-29",
    "financing_contingency_date": "2026-02-12",
    "title_review_deadline": "2026-02-14",
    "closing_date": "2026-03-06",
    "possession": "at closing, keys delivered at recording",
    "financing_type": "FHA mortgage",
    "loan_amount": 520528,
    "down_payment": 193362,
    "interest_rate": "7.000%",
    "deed_type": "quitclaim deed with covenant",
    "included_fixtures": "all appliances, generator, and the storage shed",
    "excluded_items": "the seller's freezer in the basement",
    "home_inspection_result": "a wet basement and an undersized electrical panel",
    "repair_request": "$8,500 credit in lieu of repairs",
    "brokerage_commission": "6% split between the brokerages",
    "transfer_date": "2026-03-06"
  }
}
