{
  "matter": {
    "docket_number": "SAG-FM-2025-754",
    "case_id": "MMC-2025-698951",
    "court_county": "Sagadahoc",
    "court_location": "Bath",
    "court_type": "District Court",
    "court_address": "96 Federal Street, Bath, ME 04050",
    "case_type": "parental_rights",
    "filing_date": "2025-11-08",
    "event_date": "2025-05-29"
  },
  "parties": {
    "plaintiff": {
      "full_name": "Grace C. Roe",
      "first_name": "Grace",
      "middle_name": "C",
      "last_name": "Roe",
      "address": "422 Spruce Avenue",
      "city": "Yarmouth",
      "state": "ME",
      "zip": "04047",
      "phone": "(207) 555-0174",
      "email": "grace.roe@example.com",
      "date_of_birth": "1969-04-20"
    },
    "defendant": {
      "full_name": "Maria Q. Fairbanks",
      "first_name": "Maria",
      "middle_name": "Q",
      "last_name": "Fairbanks",
      "address": "37 Cedar Way",
      "city": "Falmouth",
      "state": "ME",
      "zip": "04071",
      "phone": "(207) 555-0154",
      "email": "maria.fairbanks@example.com",
      "date_of_birth": "1965-03-05"
    },
    "child_1": {
      "full_name": "Rosa P. Kingsley",
      "first_name": "Rosa",
      "middle_name": "P",
      "last_name": "Kingsley",
      "date_of_birth": "2024-04-23"
    }
  },
  "party": {
    "full_name": "Grace C. Roe",
    "first_name": "Grace",
    "middle_name": "C",
    "last_name": "Roe",
    "address": "422 Spruce Avenue",
    "city": "Yarmouth",
    "state": "ME",
    "zip": "04047",
    "phone": "(207) 555-0174",
    "email": "grace.roe@example.com",
    "date_of_birth": "1969-04-20",
    "signature": "Grace C. Roe"
  },
  "facts": {
    "child_current_state": "Maine",
    "other_parent_state": "Massachusetts",
    "relocation_date": "2025-05-29",
    "months_child_in_maine": 15,
    "existing_order": "no prior custody order exists",
    "emergency_basis": true,
    "is_self_represented": true,
    "relief_sought": "modify an existing out-of-state order"
  }
}
